{
  "$schema": "https://json-schema.org/draft/2020-12/schema",
  "$id": "https://review-bench.ai/schema/agent-manifest.schema.json",
  "title": "ReviewBench agent manifest",
  "description": "Describes how to reach a vendor's agent. Declares the shape of any credentials it needs, never their values.",
  "type": "object",
  "additionalProperties": false,
  "required": [
    "name",
    "display_name",
    "image",
    "contacts"
  ],
  "anyOf": [
    { "required": ["model_api_url"] },
    { "required": ["egress"], "properties": { "egress": { "minItems": 1 } } }
  ],
  "properties": {
    "name": {
      "type": "string",
      "description": "Stable identifier, used as the producer on every finding. Lowercase letters, digits, dot, underscore, dash.",
      "pattern": "^[a-z0-9][a-z0-9._-]{1,63}$"
    },
    "display_name": {
      "type": "string",
      "description": "How the reviewer is named on the leaderboard.",
      "minLength": 1,
      "maxLength": 64
    },
    "provider": {
      "type": "string",
      "description": "The company or individual behind the reviewer. Optional: when omitted, the API stores the display_name here.",
      "minLength": 1,
      "maxLength": 64
    },
    "image": {
      "type": "string",
      "description": "Container image on the GitHub Container Registry, pinned by digest so a run is reproducible and the bytes cannot change under us: ghcr.io/<owner>/<name>@sha256:<64 hex>.",
      "pattern": "^ghcr\\.io/[a-z0-9]+([._-][a-z0-9]+)*(/[a-z0-9]+([._-][a-z0-9]+)*)+@sha256:[a-f0-9]{64}$"
    },
    "configuration": {
      "type": "array",
      "description": "Labels distinguishing this configuration from others you test, such as model or effort tier.",
      "maxItems": 6,
      "items": {
        "type": "object",
        "additionalProperties": false,
        "required": [
          "key",
          "value"
        ],
        "properties": {
          "key": {
            "type": "string",
            "description": "Becomes the environment variable RB_CONFIG_<KEY> inside the container, upper-cased. Letters, digits, underscore, dash; starts with a letter.",
            "pattern": "^[A-Za-z][A-Za-z0-9_-]{0,31}$"
          },
          "value": {
            "type": "string",
            "maxLength": 64
          },
          "display_value": {
            "type": "string",
            "maxLength": 64
          }
        }
      }
    },
    "secrets": {
      "type": "object",
      "description": "The SHAPE of the credentials your agent needs. Values are never placed here; they are collected separately and stored write-only.",
      "additionalProperties": false,
      "properties": {
        "env": {
          "type": "array",
          "description": "Environment variable names your agent reads.",
          "maxItems": 16,
          "items": {
            "type": "string",
            "pattern": "^[A-Za-z_][A-Za-z0-9_]*$"
          }
        },
        "files": {
          "type": "array",
          "description": "Absolute paths your agent expects a credential file at.",
          "maxItems": 8,
          "items": {
            "type": "string",
            "pattern": "^/[^\u0000\n\r]+$"
          }
        }
      }
    },
    "egress": {
      "type": "array",
      "description": "Hosts your agent contacts besides the host of model_api_url, which is allowed for you. Anything else is blocked during a run. Give model_api_url, at least one host here, or both.",
      "maxItems": 32,
      "items": {
        "type": "string",
        "pattern": "^[a-z0-9]([a-z0-9-]{0,61}[a-z0-9])?(\\.[a-z0-9]([a-z0-9-]{0,61}[a-z0-9])?)+$"
      }
    },
    "model_api_url": {
      "type": "string",
      "description": "The model API your agent calls, for example https://api.openai.com/v1 or https://<resource>.openai.azure.com/openai/v1. It reaches your container as RB_MODEL_BASE_URL, and its host is added to egress, so the endpoint is set in one place.",
      "maxLength": 200,
      "pattern": "^https://([a-z0-9]([a-z0-9-]{0,61}[a-z0-9])?\\.)+[a-z]([a-z0-9-]{0,61}[a-z0-9])?(/([A-Za-z0-9._~!$&'()*+,;=:@/-]|%[0-9A-Fa-f]{2})*)?$"
    },
    "pr_timeout_seconds": {
      "type": "integer",
      "description": "Seconds your agent needs for one pull request. Ask for more only if you need it; longer runs are more likely to be cut short.",
      "minimum": 60,
      "maximum": 3600,
      "default": 1800
    },
    "contacts": {
      "type": "array",
      "description": "GitHub usernames allowed to act for this agent: start runs, publish, rotate credentials. Everything a vendor does later is checked against this list.",
      "minItems": 1,
      "maxItems": 8,
      "items": {
        "type": "string",
        "pattern": "^[a-z0-9](?:[a-z0-9]|-(?=[a-z0-9])){0,38}$"
      }
    },
    "notes": {
      "type": "string",
      "description": "Anything we should know when running your agent.",
      "maxLength": 1000
    },
    "image_visibility": {
      "type": "string",
      "enum": [
        "public",
        "private"
      ],
      "description": "public: the runner pulls anonymously. private: the runner pulls with the GHCR_PULL_TOKEN the vendor stores with its credentials (a GitHub token with read:packages)."
    }
  }
}
