{
  "name": "example-reviewer",
  "display_name": "Example Reviewer",
  "provider": "Example Corp",
  "image": "ghcr.io/example-corp/example-reviewer@sha256:0000000000000000000000000000000000000000000000000000000000000000",
  "configuration": [
    {
      "key": "model",
      "value": "example-1",
      "display_value": "Example 1"
    },
    {
      "key": "effort",
      "value": "balanced",
      "display_value": "Balanced"
    }
  ],
  "secrets": {
    "env": [
      "EXAMPLE_API_KEY"
    ],
    "files": [
      "/root/.config/example/creds.json"
    ]
  },
  "egress": [
    "api.example.com"
  ],
  "pr_timeout_seconds": 900,
  "contacts": [
    "example-maintainer"
  ],
  "notes": "Reference manifest. Not a real agent."
}
