{
  "name": "deepseek-harness-reviewer",
  "display_name": "DeepSeek Harness Reviewer",
  "image": "ghcr.io/fangkangmi/deepseek-reviewer@sha256:2c4ac947253112dbdfb82ee4f77e79c94e1cdfc06f7003e6fff0b0b7373834f7",
  "image_visibility": "public",
  "pr_timeout_seconds": 2400,
  "configuration": [
    {
      "key": "model",
      "value": "deepseek-flash"
    },
    {
      "key": "effort",
      "value": "high"
    },
    {
      "key": "timeout_seconds",
      "value": "2400"
    }
  ],
  "secrets": {
    "env": [
      "DEEPSEEK_API_KEY"
    ]
  },
  "model_api_url": "https://api.deepseek.com",
  "contacts": [
    "fangkangmi"
  ],
  "provider": "DeepSeek Harness Reviewer",
  "egress": [
    "api.deepseek.com"
  ]
}
